name,url,brand,price,model,rating,no_of_ratings,Stock_availability,specifications,reviews,image_link
Men's Business Watch Gold Blue with Large Easy-Read Analog Quartz Date Display Luxury Stainless Steel Band Waterproof Luminous Hands,https://www.amazon.in/sspa/click?ie=UTF8&spc=MToxMjIzNTk5MjMyNzE4ODAzOjE3Mjk0NDQ1ODk6c3BfYXRmOjMwMDIwNzY2NTk5NTkzMjo6MDo6&url=%2FOLEVS-Business-Easy-Read-Stainless-Waterproof%2Fdp%2FB0D44XGZD8%2Fref%3Dsr_1_1_sspa%3Fcrid%3D16JP1M1PNQ856%26dib%3DeyJ2IjoiMSJ9.g4Rc8Cyogztwfi66n1FRmu1aOfO1gsYHOy4PLjIPPaUG42-Ad8WipRhgH7cXvtD5CjUNF6JFcmIuvcTyMgMOzfVxzFKfq87xsM3uSoaJ2zzqzaaOP9OSZYipI7rhnrUt-oX5CrsF-KVKIVhSl6oAF4YiSfXn-EWPCLhAN0-dqeCgQL3QrMLBG2QmhmOqlt571TjH-lPnbLGnrIpSwSL34BPoQYFukBij5OAD73wmW0HJpaIEI5xdI4lbKQQzX3uEsK51iMgpTJB6skZ4Iars5tcf3zdee3mcNleY7e0R39s.6Wz-9feejSJlEZZlWri2Es9_WlzhQ7zqWXfMQJsRQSM%26dib_tag%3Dse%26keywords%3Dwatch%26qid%3D1729444589%26sprefix%3Dwatch%252Caps%252C245%26sr%3D8-1-spons%26sp_csd%3Dd2lkZ2V0TmFtZT1zcF9hdGY%26psc%3D1,OLEVS,"3,040",OLS-IND-G2900GJ-QJ,3.7,231,In stock,"{'case_material': 'Stainless Steel', 'crystal_material': 'Mineral', 'band_material': 'Stainless Steel', 'water_resistant_depth': '30 Meters', 'item_weight': '120 g'}","[{'Review Rating': '5.0', 'Review Text': '', 'Reviewer Name': 'arnab', 'Review Date': 'Reviewed in India on 3 August 2024'}, {'Review Rating': '4.0', 'Review Text': 'Nice Product', 'Reviewer Name': 'V Srikanth', 'Review Date': 'Reviewed in India on 1 October 2024'}, {'Review Rating': '1.0', 'Review Text': 'This Watch is only looking good, but functions are not working properly p. Even they are not sending original user Manual', 'Reviewer Name': 'Deepak mishra', 'Review Date': 'Reviewed in India on 17 September 2024'}, {'Review Rating': '5.0', 'Review Text': ' ', 'Reviewer Name': 'Rajesh', 'Review Date': 'Reviewed in India on 16 August 2024'}, {'Review Rating': '2.0', 'Review Text': 'The watch was beautiful but had a very small dial except it all the things worked well.The locking system was a bit shaky but it worked.', 'Reviewer Name': 'Amandeep', 'Review Date': 'Reviewed in India on 17 June 2024'}, {'Review Rating': '1.0', 'Review Text': 'Very light weight and not comfortable many vest', 'Reviewer Name': 'Krishnand sahu', 'Review Date': 'Reviewed in India on 27 September 2024'}, {'Review Rating': '1.0', 'Review Text': ""It's a poor quality watch. The one we get for Rs. 200 is much better."", 'Reviewer Name': 'Amazon Customer', 'Review Date': 'Reviewed in India on 26 August 2024'}, {'Review Rating': '1.0', 'Review Text': 'Very bad 😡🤬🤬', 'Reviewer Name': 'Arsh khan', 'Review Date': 'Reviewed in India on 5 September 2024'}, {'Review Rating': '5.0', 'Review Text': 'Overall the watch is a good watch. It was easy to set up and wind for the first use. The look and feel is good as well. My only complaint would be that the pins can be a bit stubborn to get out and back in when sizing the band. For the price this seems to be a good reliable watch so far.', 'Reviewer Name': 'Kristina P.', 'Review Date': 'Reviewed in the United States on 3 May 2024'}, {'Review Rating': '5.0', 'Review Text': 'Relógio muito bom excelente compra super indico só demorou um pouco a chegar mas isto foram os contratempos dos correios mas chegou tudo certinho relógio de muito boa qualidade', 'Reviewer Name': 'Cliente', 'Review Date': 'Reviewed in Brazil on 21 February 2023'}, {'Review Rating': '3.0', 'Review Text': 'The band has no fine adjustment, as other bands. Could not get it to fit properly, l will have to go to a jeweler and get another band with fine adjustment. If it was not for the band I would have given 5 stars.', 'Reviewer Name': 'Jimmy M.', 'Review Date': 'Reviewed in the United States on 24 October 2021'}, {'Review Rating': '5.0', 'Review Text': ""I've had the watch for about a week and just wore it for the first time today. I've kept it wound since I got it and it keeps great time so far.\n\nFor the price I find it difficult to call it a timepiece or luxury watch, but it would do a great job as a poser for a much higher end watch. I'll see if I get any comments when worn in a group setting but I see no reason why it wouldn't.\n\nAll in all I am very satisfied with this watch and would recommend it for others to try."", 'Reviewer Name': 'GS Corvette', 'Review Date': 'Reviewed in the United States on 15 July 2021'}, {'Review Rating': '3.0', 'Review Text': 'Achei o produto de ótima qualidade construtiva e com um bom acabamento, no entanto, o tamanho do relógio, que é descrito e indicado para homens, ao receber, verifiquei que o mesmo está mais voltado para crianças do sexo masculino, ou seja, muito pequeno.', 'Reviewer Name': 'Diógenes Silva', 'Review Date': 'Reviewed in Brazil on 10 June 2023'}]",https://m.media-amazon.com/images/I/61jWVri+4jL._SX679_.jpg
Mens Watches Chronograph Diamond Quartz Date Calendar Moon Phase Luxury Two Tone Stainless Steel Waterproof Luminous Business Wrist Watch,https://www.amazon.in/sspa/click?ie=UTF8&spc=MToxMjIzNTk5MjMyNzE4ODAzOjE3Mjk0NDQ1ODk6c3BfYXRmOjMwMDIzNzE0MzMxODAzMjo6MDo6&url=%2FOLEVS-Chronograph-Calendar-Stainless-Waterproof%2Fdp%2FB0D6YRDT6P%2Fref%3Dsr_1_2_sspa%3Fcrid%3D16JP1M1PNQ856%26dib%3DeyJ2IjoiMSJ9.g4Rc8Cyogztwfi66n1FRmu1aOfO1gsYHOy4PLjIPPaUG42-Ad8WipRhgH7cXvtD5CjUNF6JFcmIuvcTyMgMOzfVxzFKfq87xsM3uSoaJ2zzqzaaOP9OSZYipI7rhnrUt-oX5CrsF-KVKIVhSl6oAF4YiSfXn-EWPCLhAN0-dqeCgQL3QrMLBG2QmhmOqlt571TjH-lPnbLGnrIpSwSL34BPoQYFukBij5OAD73wmW0HJpaIEI5xdI4lbKQQzX3uEsK51iMgpTJB6skZ4Iars5tcf3zdee3mcNleY7e0R39s.6Wz-9feejSJlEZZlWri2Es9_WlzhQ7zqWXfMQJsRQSM%26dib_tag%3Dse%26keywords%3Dwatch%26qid%3D1729444589%26sprefix%3Dwatch%252Caps%252C245%26sr%3D8-2-spons%26sp_csd%3Dd2lkZ2V0TmFtZT1zcF9hdGY%26psc%3D1,OLEVS,"2,736",OLS-IND-G2951GJ-JB,3.9,211,In stock,"{'case_material': 'Stainless Steel', 'crystal_material': 'Mineral', 'band_material': 'Stainless Steel', 'water_resistant_depth': '30 Meters', 'item_weight': '50 g'}","[{'Review Rating': '5.0', 'Review Text': ""I have ordered this watch in Great Indian festive Sale. Received today and it's a good choice of product. The watch looks so elegant and fantastic for this price. Especially, I loved the watch lock model which is unique and has 2 way lockpress. The dial color which I ordered is blue and the number stone looks like\ndiamond stone emborsed. Overall I love the product my husband is happy."", 'Reviewer Name': 'Abirami Manigandan', 'Review Date': 'Reviewed in India on 9 October 2024'}, {'Review Rating': '5.0', 'Review Text': 'Worth full for price, nice piece, looking so dignify', 'Reviewer Name': 'Srikanth Bandi', 'Review Date': 'Reviewed in India on 19 September 2024'}, {'Review Rating': '1.0', 'Review Text': 'Watch is good but it is not working now.\n\nSeems the battery has no energy', 'Reviewer Name': 'Amazon Customer', 'Review Date': 'Reviewed in India on 30 August 2024'}, {'Review Rating': '4.0', 'Review Text': 'Beautiful watch', 'Reviewer Name': 'Utkarsh', 'Review Date': 'Reviewed in India on 14 September 2024'}, {'Review Rating': '5.0', 'Review Text': 'Good product worthy as per money!!', 'Reviewer Name': 'Good product', 'Review Date': 'Reviewed in India on 2 October 2024'}, {'Review Rating': '5.0', 'Review Text': 'Outstanding look and mind blowing dial quality is very good', 'Reviewer Name': 'Puneet Awasthi', 'Review Date': 'Reviewed in India on 9 September 2024'}, {'Review Rating': '3.0', 'Review Text': 'Daily use ke liye Aisa company achcha hai', 'Reviewer Name': 'Amazon Customer', 'Review Date': 'Reviewed in India on 16 July 2024'}, {'Review Rating': '5.0', 'Review Text': 'Looks Beautiful, very impressive', 'Reviewer Name': 'Nalinikanth', 'Review Date': 'Reviewed in India on 9 September 2024'}, {'Review Rating': '5.0', 'Review Text': 'The most beautiful Watch. I have one for\nmy black & one for my brown clothes & l still have $ in my pocket.', 'Reviewer Name': 'B Bates', 'Review Date': 'Reviewed in the United States on 2 May 2024'}, {'Review Rating': '5.0', 'Review Text': 'The watch receives compliments all the time. A really nice piece.', 'Reviewer Name': 'Jeff Waselynchuk', 'Review Date': 'Reviewed in Canada on 30 June 2023'}, {'Review Rating': '5.0', 'Review Text': 'Bello estilo y bella apariencia', 'Reviewer Name': 'Alejandro E.', 'Review Date': 'Reviewed in Mexico on 14 December 2022'}, {'Review Rating': '3.0', 'Review Text': 'Es más pequeño de lo que aparenta en las imágenes. El aditamento para quitar los eslabones fue imposible de utilizar, tuve que ir a un relojero. Por lo demás esta bonito.', 'Reviewer Name': 'José Luis Mejía', 'Review Date': 'Reviewed in Mexico on 16 June 2023'}, {'Review Rating': '1.0', 'Review Text': 'Strap is not good', 'Reviewer Name': 'VIPIN', 'Review Date': 'Reviewed in Saudi Arabia on 7 January 2024'}]",https://m.media-amazon.com/images/I/61JItBgSibL._SX679_.jpg
Watch for Men Skeleton Analog Quartz Chronograph Diamond Watches Stainless Steel Moon Phase Calendar Waterproof Wrist Watch,https://www.amazon.in/sspa/click?ie=UTF8&spc=MToxMjIzNTk5MjMyNzE4ODAzOjE3Mjk0NDQ1ODk6c3BfYXRmOjMwMDIwMTY3NDYyMDEzMjo6MDo6&url=%2FOLEVS-Business-Stainless-Waterproof-Luminous%2Fdp%2FB0D4VGVSYN%2Fref%3Dsr_1_3_sspa%3Fcrid%3D16JP1M1PNQ856%26dib%3DeyJ2IjoiMSJ9.g4Rc8Cyogztwfi66n1FRmu1aOfO1gsYHOy4PLjIPPaUG42-Ad8WipRhgH7cXvtD5CjUNF6JFcmIuvcTyMgMOzfVxzFKfq87xsM3uSoaJ2zzqzaaOP9OSZYipI7rhnrUt-oX5CrsF-KVKIVhSl6oAF4YiSfXn-EWPCLhAN0-dqeCgQL3QrMLBG2QmhmOqlt571TjH-lPnbLGnrIpSwSL34BPoQYFukBij5OAD73wmW0HJpaIEI5xdI4lbKQQzX3uEsK51iMgpTJB6skZ4Iars5tcf3zdee3mcNleY7e0R39s.6Wz-9feejSJlEZZlWri2Es9_WlzhQ7zqWXfMQJsRQSM%26dib_tag%3Dse%26keywords%3Dwatch%26qid%3D1729444589%26sprefix%3Dwatch%252Caps%252C245%26sr%3D8-3-spons%26sp_csd%3Dd2lkZ2V0TmFtZT1zcF9hdGY%26psc%3D1,OLEVS,"2,850",MJ-IND-G9931-JL,4.0,"4,568",In stock,"{'case_material': 'Stainless Steel', 'crystal_material': 'Glass', 'band_material': 'Stainless Steel', 'water_resistant_depth': '30 Meters', 'item_weight': '50 g'}","[{'Review Rating': '5.0', 'Review Text': '', 'Reviewer Name': 'Tech review', 'Review Date': 'Reviewed in India on 15 October 2024'}, {'Review Rating': '4.0', 'Review Text': '', 'Reviewer Name': 'Uttkarsh', 'Review Date': 'Reviewed in India on 4 October 2024'}, {'Review Rating': '5.0', 'Review Text': 'Chronograph is not working', 'Reviewer Name': 'Rajesh', 'Review Date': 'Reviewed in India on 11 October 2024'}, {'Review Rating': '1.0', 'Review Text': '""I previously purchased an Olevs watch for myself and was satisfied, so I ordered another one as a gift. Unfortunately, the quality this time is disappointing. The watch feels much lighter, the material seems lower in quality, and it occasionally stops working. I can\'t recommend this version based on my experience.""', 'Reviewer Name': 'Sumit Dadwal', 'Review Date': 'Reviewed in India on 29 September 2024'}, {'Review Rating': '5.0', 'Review Text': 'Lovely watch just a wowww.best for gifting.', 'Reviewer Name': 'John', 'Review Date': 'Reviewed in India on 10 October 2024'}, {'Review Rating': '3.0', 'Review Text': ""This is gorgeous. However there is no Date or Month Calendar, don't know how the min and hour module works. Tried several combinations as mentioned on the manual without any luck. If someone from support team can call me and guide me through the 'Calendar' would be very good."", 'Reviewer Name': 'Jyotiraj', 'Review Date': 'Reviewed in India on 19 September 2024'}, {'Review Rating': '5.0', 'Review Text': 'Nice product', 'Reviewer Name': 'andhollafrooti', 'Review Date': 'Reviewed in India on 16 October 2024'}, {'Review Rating': '4.0', 'Review Text': 'Nice 👍', 'Reviewer Name': 'Placeholder', 'Review Date': 'Reviewed in India on 14 October 2024'}, {'Review Rating': '5.0', 'Review Text': ""This watch is classically beautiful I'm always getting asked where I got it from.. You won't be disappointed .. its just perfect."", 'Reviewer Name': 'Amazon Customer', 'Review Date': 'Reviewed in the United States on 14 October 2024'}, {'Review Rating': '5.0', 'Review Text': 'As someone who is usually an Apple Watch user, it’s nice to go back to traditional analog, and this is easier to read. I do wish that it would have more water resistance and maybe the battery could be a little bit more better but overall, this is a really good watch.', 'Reviewer Name': 'Ronan Daglish', 'Review Date': 'Reviewed in the United States on 30 September 2024'}, {'Review Rating': '5.0', 'Review Text': 'Very nice looking watch. Looks fancy and an eye turner at the office. Very comfortable. Love all the little dials. Came with tools to adjust the wrist band. The wrist band feels and sounds hallow. Not full metal material but doesn’t bother me at all. Not bad for the price.', 'Reviewer Name': 'Rick', 'Review Date': 'Reviewed in the United States on 20 September 2024'}, {'Review Rating': '5.0', 'Review Text': 'This is an attractive, manly watch. You cant help but notice it when its worn. I got it for my son and he loved wearing it everywhere but as he is an active young man and wanted to wear it constantly, he decided to wear it while playing volleyball (bad idea) and the watch band broke on impact. Obviously not to be worn while playing sports. I do not blame that on the quality of the watch, however, as it is a great value for what you pay.', 'Reviewer Name': 'Natasha', 'Review Date': 'Reviewed in the United States on 5 September 2024'}, {'Review Rating': '5.0', 'Review Text': 'My husband gets compliments on this watch all the time. He wears it in the pool and while working outside, very durable.', 'Reviewer Name': 'Joyce Cleary', 'Review Date': 'Reviewed in the United States on 29 August 2024'}]",https://m.media-amazon.com/images/I/71PNFOHsITL._SX679_.jpg
Watches for Men Chronograph Business Wrist Watches Analog Quartz Moon Phase Stainless Steel Waterproof Luminous Dress Watches,https://www.amazon.in/sspa/click?ie=UTF8&spc=MToxMjIzNTk5MjMyNzE4ODAzOjE3Mjk0NDQ1ODk6c3BfYXRmOjMwMDE0NDExOTgyNzAzMjo6MDo6&url=%2FOLEVS-Chronograph-Business-Stainless-Waterproof%2Fdp%2FB0CTG28V5T%2Fref%3Dsr_1_4_sspa%3Fcrid%3D16JP1M1PNQ856%26dib%3DeyJ2IjoiMSJ9.g4Rc8Cyogztwfi66n1FRmu1aOfO1gsYHOy4PLjIPPaUG42-Ad8WipRhgH7cXvtD5CjUNF6JFcmIuvcTyMgMOzfVxzFKfq87xsM3uSoaJ2zzqzaaOP9OSZYipI7rhnrUt-oX5CrsF-KVKIVhSl6oAF4YiSfXn-EWPCLhAN0-dqeCgQL3QrMLBG2QmhmOqlt571TjH-lPnbLGnrIpSwSL34BPoQYFukBij5OAD73wmW0HJpaIEI5xdI4lbKQQzX3uEsK51iMgpTJB6skZ4Iars5tcf3zdee3mcNleY7e0R39s.6Wz-9feejSJlEZZlWri2Es9_WlzhQ7zqWXfMQJsRQSM%26dib_tag%3Dse%26keywords%3Dwatch%26qid%3D1729444589%26sprefix%3Dwatch%252Caps%252C245%26sr%3D8-4-spons%26sp_csd%3Dd2lkZ2V0TmFtZT1zcF9hdGY%26psc%3D1,OLEVS,"3,040",OLS-IND-G2859GJ-JB,3.6,"1,283",In stock,"{'case_material': 'Stainless Steel', 'crystal_material': 'Mineral', 'band_material': 'Stainless Steel', 'water_resistant_depth': '30 Meters', 'item_weight': '150 g'}","[{'Review Rating': '5.0', 'Review Text': ""Good product and good looking. Given for my son's birthday gift.\nValue for money.\nWorking well."", 'Reviewer Name': 'Sankar.', 'Review Date': 'Reviewed in India on 27 September 2024'}, {'Review Rating': '1.0', 'Review Text': ""Totally Waste of Money.. don't buy.. is not exactly as shown in Amazon..size is very small and quality is very Poor ..I am Returning it ..."", 'Reviewer Name': 'Rishabh Singh', 'Review Date': 'Reviewed in India on 1 October 2024'}, {'Review Rating': '4.0', 'Review Text': 'Nice watch also quality is good', 'Reviewer Name': 'Anil N.', 'Review Date': 'Reviewed in India on 4 October 2024'}, {'Review Rating': '5.0', 'Review Text': 'I am happy to share, I like this product and enjoy with stylish.', 'Reviewer Name': 'kashinath', 'Review Date': 'Reviewed in India on 10 October 2024'}, {'Review Rating': '3.0', 'Review Text': 'Watch style is very good ..but confused about warranty period?', 'Reviewer Name': 'guruatta powar', 'Review Date': 'Reviewed in India on 17 September 2024'}, {'Review Rating': '5.0', 'Review Text': 'Super product', 'Reviewer Name': 'Placeholder', 'Review Date': 'Reviewed in India on 24 September 2024'}, {'Review Rating': '1.0', 'Review Text': 'Quality of this watch strip is a low grade steel which catch rust in 2-3 month of use.', 'Reviewer Name': 'avinash ankit', 'Review Date': 'Reviewed in India on 6 October 2024'}, {'Review Rating': '4.0', 'Review Text': ""It's was really value for money..\nIt was unbelievable that this price range how they make this"", 'Reviewer Name': 'Akassh', 'Review Date': 'Reviewed in India on 5 October 2024'}, {'Review Rating': '5.0', 'Review Text': ""My husband literally thought I spent hundreds on this watch. And he knew we couldn't afford that. It totally stunned him. He still hasn't figured out all the bells and whistles it has, but he has time for that. He even wants to buy 1 or 2 more for replacement when it's necessary."", 'Reviewer Name': 'Laura Plumlee', 'Review Date': 'Reviewed in the United States on 29 August 2024'}, {'Review Rating': '5.0', 'Review Text': ""Watch is as expected. It works, it's pretty, and the band seems like it's a good enough quality that it should last and look nice for a long time."", 'Reviewer Name': 'Leslie', 'Review Date': 'Reviewed in the United States on 26 July 2024'}, {'Review Rating': '5.0', 'Review Text': 'Muito bom o relógio, chegou no prazo. Relógio bonito e está funcionando bem.', 'Reviewer Name': 'Débora', 'Review Date': 'Reviewed in Brazil on 30 November 2023'}, {'Review Rating': '5.0', 'Review Text': ' ', 'Reviewer Name': 'Taka', 'Review Date': 'Reviewed in Japan on 25 January 2024'}, {'Review Rating': '2.0', 'Review Text': '2回仕様したらバンドの留め具が曲がり、バンドが外れてしまいました。もう少し長めのバンドが良かったですけどね。時計自体はいい感じですが。', 'Reviewer Name': '匿名', 'Review Date': 'Reviewed in Japan on 29 May 2023'}]",https://m.media-amazon.com/images/I/61UY1fwGjqL._SX679_.jpg
"Fire-Boltt Ninja Call Pro Plus 46.48mm (1.83 inch) Smart Watch with Bluetooth Calling, AI Voice Assistance, 120 Sports Modes IP67 Rating, 240 * 280 Pixel High Resolution (Black)",https://www.amazon.in/Fire-Boltt-Bluetooth-Calling-Assistance-Resolution/dp/B0BF57RN3K/ref=sr_1_5?crid=16JP1M1PNQ856&dib=eyJ2IjoiMSJ9.g4Rc8Cyogztwfi66n1FRmu1aOfO1gsYHOy4PLjIPPaUG42-Ad8WipRhgH7cXvtD5CjUNF6JFcmIuvcTyMgMOzfVxzFKfq87xsM3uSoaJ2zzqzaaOP9OSZYipI7rhnrUt-oX5CrsF-KVKIVhSl6oAF4YiSfXn-EWPCLhAN0-dqeCgQL3QrMLBG2QmhmOqlt571TjH-lPnbLGnrIpSwSL34BPoQYFukBij5OAD73wmW0HJpaIEI5xdI4lbKQQzX3uEsK51iMgpTJB6skZ4Iars5tcf3zdee3mcNleY7e0R39s.6Wz-9feejSJlEZZlWri2Es9_WlzhQ7zqWXfMQJsRQSM&dib_tag=se&keywords=watch&qid=1729444589&sprefix=watch%2Caps%2C245&sr=8-5,Fire-Boltt,999,,4.1,"80,135",In stock,"{'case_material': None, 'crystal_material': None, 'band_material': None, 'water_resistant_depth': None, 'item_weight': '50 g'}","[{'Review Rating': '4.0', 'Review Text': 'I recently purchased the Fire-Boltt Ninja Call Pro Smart Watch, and I am thoroughly impressed with its performance! The design is sleek and stylish, making it a perfect accessory for both casual and professional settings. The call functionality is seamless, with clear audio on both ends. I also appreciate the variety of fitness and health tracking features, including the heart rate monitor and sleep tracker, which help me stay on top of my wellness goals.\n\nThe battery life is excellent, easily lasting several days on a single charge, even with regular use. The touchscreen is responsive, and navigating through the menus is intuitive. Plus, the multiple sports modes and custom watch faces are a great bonus.\n\nOverall, this smartwatch delivers great value for money and has exceeded my expectations. I highly recommend the Fire-Boltt Ninja Call Pro for anyone looking for a reliable and feature-packed smartwatch!', 'Reviewer Name': 'shylesh', 'Review Date': 'Reviewed in India on 9 October 2024'}, {'Review Rating': '4.0', 'Review Text': 'I recently purchased the Fire-Boltt Ninja Call Pro Smart Watch, and I am thoroughly impressed with its performance! The design is sleek and stylish, making it a perfect accessory for both casual and professional settings. The call functionality is seamless, with clear audio on both ends. I also appreciate the variety of fitness and health tracking features, including the heart rate monitor and sleep tracker, which help me stay on top of my wellness goals.\n\nThe battery life is excellent, easily lasting several days on a single charge, even with regular use. The touchscreen is responsive, and navigating through the menus is intuitive. Plus, the multiple sports modes and custom watch faces are a great bonus.\n\nOverall, this smartwatch delivers great value for money and has exceeded my expectations. I highly recommend the Fire-Boltt Ninja Call Pro for anyone looking for a reliable and feature-packed smartwatch!', 'Reviewer Name': 'Anupam Kumar', 'Review Date': 'Reviewed in India on 8 October 2024'}, {'Review Rating': '4.0', 'Review Text': 'I recently purchased the Fire-Boltt Ninja Call Pro Smart Watch, and I am thoroughly impressed with its performance! The design is sleek and stylish, making it a perfect accessory for both casual and professional settings. The call functionality is seamless, with clear audio on both ends. I also appreciate the variety of fitness and health tracking features, including the heart rate monitor and sleep tracker, which help me stay on top of my wellness goals.\n\nThe battery life is excellent, easily lasting several days on a single charge, even with regular use. The touchscreen is responsive, and navigating through the menus is intuitive. Plus, the multiple sports modes and custom watch faces are a great bonus.\n\nOverall, this smartwatch delivers great value for money and has exceeded my expectations. I highly recommend the Fire-Boltt Ninja Call Pro for anyone looking for a reliable and feature-packed smartwatch!', 'Reviewer Name': 'Madhukar bandi', 'Review Date': 'Reviewed in India on 7 October 2024'}, {'Review Rating': '4.0', 'Review Text': 'I recently purchased the Fire-Boltt Ninja Call Pro Smart Watch, and I am thoroughly impressed with its performance! The design is sleek and stylish, making it a perfect accessory for both casual and professional settings. The call functionality is seamless, with clear audio on both ends. I also appreciate the variety of fitness and health tracking features, including the heart rate monitor and sleep tracker, which help me stay on top of my wellness goals.\n\nThe battery life is excellent, easily lasting several days on a single charge, even with regular use. The touchscreen is responsive, and navigating through the menus is intuitive. Plus, the multiple sports modes and custom watch faces are a great bonus.\n\nOverall, this smartwatch delivers great value for money and has exceeded my expectations. I highly recommend the Fire-Boltt Ninja Call Pro for anyone looking for a reliable and feature-packed smartwatch!', 'Reviewer Name': 'JOHN MANI', 'Review Date': 'Reviewed in India on 30 September 2024'}, {'Review Rating': '4.0', 'Review Text': 'The Fire-Boltt Ninja Call Pro Max (51.05mm) is an excellent smartwatch that offers great value for its price. It features a large, clear display, making navigation easy. With Bluetooth calling, multiple sports modes, and health tracking (like heart rate and SpO2 monitoring), it covers essential smartwatch functions. The battery life is impressive, lasting several days on a single charge. Its sleek design adds to its appeal, making it both functional and stylish. Overall, a very good product for those seeking a budget-friendly yet feature-packed smartwatch.', 'Reviewer Name': 'Rajendra', 'Review Date': 'Reviewed in India on 10 October 2024'}, {'Review Rating': '4.0', 'Review Text': 'call functionality is seamless, with clear audio on both ends. I also appreciate the variety of fitness and health tracking features, including the heart rate monitor and sleep tracker, which help me stay on top of my wellness goals.\n\nThe battery life is excellent, easily lasting several days on a single charge, even with regular use. The touchscreen is responsive, and navigating through the menus is intuitive. Plus, the multiple sports modes and custom watch faces are a great bonus.\n\nOverall, this smartwatch delivers great value for money and has exceeded my expectations. I highly recommend the Fire-Boltt Ninja Call Pro for anyone looking for a reliable and feature-packed smartwatch!', 'Reviewer Name': 'Mohd Akbar shareef', 'Review Date': 'Reviewed in India on 18 October 2024'}]",https://m.media-amazon.com/images/I/61FQOvP93fL._SX679_.jpg
